item_qid,label_zh,label_kk,label_en,description_zh,description_kk,description_en
P87,劇作者,,librettist,歌劇、輕歌劇、神劇或清唱套曲的作詞者，或音樂劇劇本的作者,,"author of the libretto (words) of an opera, operetta, oratorio or cantata, or of the book of a musical"
P913,符號,,notation,,,mathematical notation or another symbol
P9488,使用領域,,field of usage,這個意義的專門領域或術語,,specialized area or terminology where this sense is used
P1071,制作地点,,location of creation,製作物品的地方; 最終裝配的位置,,"place where the item was conceived or made; where applicable, location of final assembly"
P8693,粉絲文化,,fandom,,,"fan group of a celebrity, musical group, artist, work, etc."
P69,就读于,оқыған жері,educated at,主体就读的教育机构,,educational institution attended by subject
P3179,领土重合于,,territory overlaps,與該實體關聯的部分或全部區域與該實體關聯的部分或全部區域重疊,,part or all of the area associated with (this) entity overlaps part or all of the area associated with that entity
P2587,具有音位,,has phoneme,語言的音韻包括這種聲音,,the language's phonology includes this sound
P1881,角色列表,кейіпкерлер тізімі,list of characters,含有介紹該作品各角色訊息的頁面,,Wikimedia page with the list of characters for this work
P4777,,,has boundary,,,element that's on the two dimensional border that surrounds the subject; the limit of an entity
P2853,電源插頭型式,,electrical plug type,,,standard plug type for mains electricity in a country
P177,跨越,,crosses,此桥梁上跨，或次隧道下跨的障碍物（水体、道路、铁路等）,,"obstacle (body of water, road, railway...) which this bridge (ferry, ford) crosses over or this tunnel goes under"
P680,分子功能,,molecular function,,,represents gene ontology function annotations
P923,医学检查,,medical examination,,,examinations that might be used to diagnose and/or prognose the medical condition
P91,性取向,,sexual orientation,標示一個人物的性取向——当且仅当他们自己明确声明，或者在他们死后被历史学家广泛认同时使用,,"the sexual orientation of the person relative to their declared gender — use ONLY IF they have stated it themselves, unambiguously, or it has been widely agreed upon by historians after their death"
P1809,编舞,,choreographer,,,person(s) who did the choreography
P1880,测量规范,,measurement scale,,,scale by which a phenomenon is measured
P9161,,,thesis committee member,,,"member of the committee for this thesis or dissertation; for any type of thesis (bachelor's, master's, doctoral, etc.). Qualify with ""object has role"" (P3831) to indicate chair"
P3259,,,intangible cultural heritage status,,,status of an item that is designated as intangible heritage
P1560,,,given name version for other gender,,,"equivalent name (with respect to the meaning of the name) in the same language: female version of a male first name, male version of a female first name. Add primarily the closest matching one"
P636,给药途径,,route of administration,将药物、液体、毒物或其他物质摄入体内的路径,,"path by which a drug, fluid, poison, or other substance is taken into the body"
P1592,檢察官,,prosecutor,,,"person representing the prosecuting authority, at a trial"
P797,管理机关,,authority,對給定實體具有行政權力的實體,,entity having executive power on given entity
P6379,館藏處,,has works in the collection,收藏有該藝術家作品的場館,,collection that has works of this person or organisation (use archives at [P485] for archives)
P1598,,,consecrator,,,bishop who presided as consecrator or co-consecrator of this bishop
P462,颜色,түс,color,主題的顏色,,color of subject
P8701,人口普查,,has census,,,general population census of the country or region
P2670,拥有此类的一部分,,has part(s) of the class,主体实例具有客体类的部分（主体通常不是类）,,the subject has one or more parts of the object class
P1406,文字方向,,script directionality,此語言的書寫系統的方向,,direction that a writing system goes in
P629,原作，或再版原作，或译本,,edition or translation of,是该实体的再版版本或译作,,is an edition or translation of this entity
P371,主持人,,presenter,电台或电视节目的主要主持人,,main role in presenting a radio or television program or a performing arts show
P2567,,,amended by,,,document is amended by specified other document
P1327,专业或体育合作伙伴,,partner in business or sport,,,professional collaborator
P163,旗帜,,flag,主体的旗帜,,subject's flag
P1906,國家元首職位,,office held by head of state,,,political office that is fulfilled by the head of state of this item
P2058,保管方,,depositary,,,depositary of the treaty
P1678,頂點圖,,has vertex figure,以幾何圖形頂角切去時所露出的形狀來描述頂角結構,,the figure exposed when a corner of a polytope is sliced off
P3364,立體異構體,,stereoisomer of,目標項目是此項目的立體異構體,,target item is a stereoisomer of this item
P921,作品主题,негізгі пән,main subject,作品的主要话题（另可参见P180，描绘对象）,,primary topic of a work (see also P180: depicts)
P2597,革蘭氏染色,,Gram staining,,,Gram stain type of a bacterial strain
P2674,下一个下游跨越点,,next crossing downstream,此河流（或运河等）在该项目下游一侧的跨越建筑,,"next crossing of this river, canal, etc. downstream of this subject"
P5841,在捷克濒危物种红色名录中的状态,,Status in the Red List of Threatened Species in the Czech Republic,,,endangerment status of species in the national Red List of the Czech Republic
P1552,特性,,has characteristic,該實體的固有性質或可辨別的質特徵,,inherent or distinguishing quality or feature of the entity. Use a more specific property when possible
P2515,服裝設計,,costume designer,,,"person who designed the costumes for a film, television programme, etc."
P6364,官方颜色,,official color,用于表示或标识项目的正式颜色,,official colors chosen to represent or identify an item
P689,影响,,afflicts,受某种病症或疾病影响的生物体或器官的类型,,"type of organism which a condition or disease afflicts (for an organ affected by a condition, use P927)"
P457,成立文书,,foundational text,成立一个机构或客体所依据的文书,,text through which an institution or object has been created or established
P8875,收录题录数据库,,indexed in bibliographic review,收录该学术期刊的题录数据库,,bibliographic review(s) and/or database(s) which index this academic journal
P3592,沙羅周期,,saros cycle of eclipse,,,
P3494,,,points classification,,,classification established according to points scored by runners
P2784,麥加利地震烈度表,,modified Mercalli intensity scale,量度地震震度的單位,,measurement of the intensity of an earthquake
P6193,批准方,,ratified by,用以指明條約已被指定國家或國際法主體批准,,used to specify that a treaty has been ratified by a given state or subject of international law
P4290,官方应用程序,,official app,本组织或其他实体的官方应用程序（Android、iOS等可下载应用程序）,,"official app for this organization or other entity (a downloadable application for Android, iOS, etc.)"
P4324,,,combination classification,,,"person ranked in ""best at combination"" for this cycling stage or race"
P5236,,,prime factor,,,one of the prime numbers that can be multiplied to give this number
P2869,,,record or record progression,,,links to item on the record or record progression
P516,发动机,,powered by,用於為主體提供動力的設備或發動機,,equipment or engine used by the subject to convert a source or energy into mechanical energy
P2499,,,league level above,,,the league above this sports league
P178,開發者,әзірлеуші,developer,開發該項目的組織或個人,,organization or person that developed the item
P6532,,,has phenotype,,,"a relationship that holds between a biological entity and a phenotype, equivalent to ""has property"" in the relation ontology http://purl.obolibrary.org/obo/RO_0002200"
P870,使用的乐器,,instrumentation,,,combination of musical instruments employed in a composition or accompanying a (folk) dance
P530,外交关系,,diplomatic relation,该国的外交关系,,diplomatic relations of the country
P8339,,,entry receptor,,,receptor protein or protein whose receptor is being used by this subject virus/microorganism group to enter cells
P37,官方语言,,official language,本项目指定的官方语言,,language designated as official by this item
P533,攻击目标,,target,军事行动或恐怖袭击的目标,,target of an attack or military operation
P40,子女,,child,主体有作为其子女的客体。 不要用于继子女,,"subject has object as child. Do not use for stepchildren—use ""relative"" (P1038), qualified with ""type of kinship"" (P1039)"
P10611,,,has certification,,,states that an item has a certain certification
P8791,電子化,,digitised by,,,"institution or person who digitised an exemplar of this item. Qualify with ""criterion used"" (P1013) to indicate which step was done."
P3985,支援的程式語言,,supports programming language,此程式設計工具支援的程式語言,,programming language which is supported by this programming tool
P1478,直接原因,,has immediate cause,,,"nearest, proximate thing that directly resulted in the subject as outcome or effect. Used in conjunction with 'has cause' (i.e. underlying cause) and 'has contributing factor'. See 'Help:Modeling causes'."
P417,主保圣人,,patron saint,该主题的守护神,,patron saint adopted by the subject
P1299,描绘作品,,depicted by,描述本主题的创意、宗教作品,,"object depicting this subject (object being creative works such as books, films, paintings)"
P1875,代表者,,represented by,,,person or agency that represents or manages the subject
P3150,生日,,birthday,出生月和日。用於無法得知完整「出生日期」(P569)時,,"item for day and month on which the subject was born. Used when full ""date of birth"" (P569) isn't known."
P135,文化运动,,movement,与此人或作品相关的文学、艺术、科学或哲学运动或事件,,"literary, artistic, scientific or philosophical movement or scene associated with this person or work. For political ideologies use P1142."
P676,作词者,,lyrics by,歌詞作者；也可以將P86用於音樂作曲家,,author of song lyrics
P180,描繪內容,суреттелген нәрсе,depicts,被描绘的实体（另见 P921：主要主体）,,"entity visually depicted in an image, literarily described in a work, or otherwise incorporated into an audiovisual or other medium; see also P921,  'main subject'"
P1877,原著作者,,after a work by,,,artist whose work strongly inspired / was copied in this item
P2817,,,appears in the heritage monument list,,,heritage monument is a part of the list of heritage monuments
P5588,入侵到,,invasive to,,,"region which a taxon is not endemic to where the taxon has a tendency to spread to a degree believed to cause damage to the environment, human economy or human health"
P9897,App Store年龄分级,,App Store age rating,Apple針對App Store中發佈的軟體內容分級分類,,content rating category by Apple for software published at the App Store
P1571,到达域,,codomain,函数输出值的集合,,codomain of a function
P1066,师承,,student of,传授技艺者,,person who has taught this person
P6886,书写语言,,writing language,作者寫作時所用的語言,,language in which the writer has written their work
P2363,NMHH電影評級,,NMHH film rating,匈牙利的電影評級,,rating of a film in the Hungarian film rating system
P8047,船舶国籍,,country of registry,船舶所进行登记注册的国家,,country where a ship is or has been registered
P793,重大事件,негізгі оқиға,significant event,相关的重大或著名的事件,элемент үшін аса маңызды оқиға,significant or notable events associated with the subject
P1424,话题主模板,негізгі тақырып үлгісі,topic's main template,该主题的主要信息框或导航模板,,the main template relating to a topic
P479,输入设备,,input device,与软件交互的方式或装置,,input device used to interact with a software or a device
P4969,衍生作品,туынды жұмыс,derivative work,從這件藝術品的主要部分創作的作品; 從該軟件的主要部分創建的工作,,"new work of art (film, book, software, etc.) derived from major part of this work"
P2596,文化,мәдениет,culture,该数据项所属的文化或民族,бұл нәрсемен байланысты мәдениет,human culture or people (or several cultures) associated with this item
P2563,,,superhuman feature or ability,,,"superhuman, supernatural, or paranormal abilities that the fictional subject exhibits"
P9652,虚构角色的性格特点,,personality trait of fictional character,,,particular personality trait which applies to this fictional character
P1889,相異於,шатастырмаңыз,different from,容易混淆但不相同的事物,"осы элементпен жиі шатастырылатын, басқа мағынасы бар элементке сілтеме","item that is different from another item, with which it may be confused"
P8193,,,hardiness of plant,,,"recommended hardiness zone for plant, ability of plant to survive adverse growing conditions"
P8702,,,parallel street,,,closest street(s) that run parallel to the item
P3080,游戏艺术家,,game artist,,,"game artist(s) that produced art assets for a role-playing games, collectible card games, video game, etc."
P4675,形态,,appears in the form of,这个虚构的或神话中的实体采取了该实体的形式,,this fictional or mythical entity takes the form of that entity
P1568,定義域,,definition domain,函數自變數所有可取值的集合,,"set of ""input"" or argument values for which a mathematical function is defined"
P739,,,ammunition,,,cartridge or other ammunition used by the subject firearm
P4387,更新方法,,update method,應用程式或作業系統接收更新或自我更新的方法,,method used by an app/OS to receive updates or self-update
P186,材料,,made from material,制品所使用的材料,,material the subject or the object is made of or derived from (do not confuse with P10672 which is used for processes)
P4788,,,storage device,,,data storage device supported by a machine (e.g. camera or mobile phone)
P2176,用藥,,drug or therapy used for treatment,治療該病使用的藥品,,"drug, procedure, or therapy that can be used to treat a medical condition"
P4844,,,research intervention,,,"the focus of an experiment, also called the experimental variable, research activity, or study intervention"
P10624,组织内官方观察员地位,,official observer status in organisation,,,Organisation by which the subject is granted observer status
P3018,所在保护区,,located in protected area,,,protected area where a place or geographical feature is physically located
P3938,命名者,,named by,对该对象命名的人或组织，用作限定符,,person or organisation that coined the name; use as qualifier for P2561 and its subproperties
P4884,法院,,court,审理该案件的法院,,specific court a legal case is/was heard/decided in
P150,下辖行政领土实体,,contains the administrative territorial entity,行政领土实体的直接细分（清单）,,(list of) direct subdivisions of an administrative territorial entity
P61,發現者或發明者,,discoverer or inventor,发现、首先描述、发明或开发此发现或发明的主体,,"subject who discovered, first described, invented, or developed this discovery or invention or scientific hypothesis or theory"
P10449,教練,,trained by,曾訓練此運動員的教練,,personal trainer of the athlete
P2522,獲勝賽事,,victory,,,competition or event won by the subject
P7501,音响系统,аудио жүйесі,audio system,音响系统硬件,,audio system hardware used in the item
P710,參與者,қатысушылар,participant,參與/參加活動的人，團體或組織（對象）（主題）。 最好使用“對像有角色”（P3831）限定符。 將P1923用於團隊參與者。,,"person, group of people or organization (object) that actively takes/took part in an event or process (subject).  Preferably qualify with ""object has role"" (P3831). Use P1923 for participants that are teams."
P6954,在线获取状态,,online access status,,,property or qualifier for an ID property indicating whether linked content is directly readable online
P5072,展示于,,presented in,舉辦談話，電影，紙張或海報的活動,,"event at which a talk, film, paper, or poster was presented"
P129,物理相互作用于,,physically interacts with,主体与之交互的物理实体,,physical entity that the subject interacts with
P2378,發行者,,issued by,發布或分配標識符的組織,,"organisation or other agent that issues or allocates an identifier, code, classification number, etc."
P1574,原本,,exemplar of,手稿、簽名、搖籃本、不同的印刷版本等所基於的原本,,"property for manuscripts, autographs, incunabula, distinct printed copies"
P542,开幕宣布人,,officially opened by,,,person that officially opened the event or place
P2632,羁押地点,,place of detention,,,place where this person is or was detained
P2417,,,stage classification,,,stage results and ranking of a stage race
P2500,,,league level below,,,the league below this sports league
P5642,风险因子,,risk factor,,,"factor associated with a high prevalence of a particular gene, disease or characteristic. These factors can be country of origin, country of citizenship, race, gender, occupation, anamnesis, etc."
P2184,主题历史,,history of topic,項目話題的歷史發展,,"item about the historical development of a subject's topic, example: ""history of Argentina"" for ""Argentina"". To list key events of the topic, use ""significant event"" (P793)"
P1542,導致,,has effect,这个项目的效果,,effect of this item
P598,,,commander of (DEPRECATED),,,"for persons who are notable as commanding officers, the units they commanded"
P7573,,,IFCO rating,,,rating certificate of a film in the Irish content classification system
P5869,範例項目,,model item,,,"defines which item is a best practice example of modelling a subject, which is described by the value of this property, usage instructions at Wikidata:Model items"
P406,原声专辑,,soundtrack release,,,music release that incorporates music directly recorded from the soundtrack of an audiovisual work
P1050,医疗状况,,medical condition,人或动物等所患疾病等健康状况,,"any state relevant to the health of an organism, including diseases and positive conditions"
P878,,,avionics,,,"notable sensors, electronics, and other avionics installed in the subject aircraft"
P5996,用于此语言电影的分类,,category for films in this language,,,link to category entity contains films in this language
P3026,休业日,,closed on,,,"exceptions to open days (P3025), usually special dates"
P4312,鏡頭設置,,camera setup,電影拍攝方式，填「單鏡頭」（Q2918907）或「多鏡頭」（Q738160）,,filmmaking method that the cameras were placed by. Use single-camera (Q2918907) or multiple-camera (Q738160)
P1074,相應虛構概念,,fictional or mythical analog of,,,used to link an entity or class of entities appearing in a creative work with the analogous entity or class of entities in the real world
P6658,RCQ分级,,RCQ classification,Régie du cinéma 对电影的评级,,movie classification for the Régie du Cinéma Québécois
P1013,使用標準,қолданылған критерий,criterion used,区分或分类所依据的属性,екі нәрсе арасындағы айырмашылықтың себебі,property by which a distinction or classification is made
P3701,,,incarnation of,,,"coming into reality of a religious or supernatural being in form of a human, a basically religious concept incompatible with modern science"
P121,運營项目,,item operated,主体操作的设备、装置或服务,,"equipment, installation or service operated by the subject"
P8329,学术带头人,,principal investigator,,,person(s) in charge of conducting a research project
P5323,文獻出處,,attested in,提及該詞條、詞義、字詞或名稱的文獻出處，未必有詳述,,"document or corpus where the lemma or form of a Lexeme entity, word or name is used, but not described"
P1419,形状,,shape,物体的几何形状,,shape of an object
P1885,,,cathedral,,,principal church of a religious district
P1817,收件人,,addressee,,,person or organization to whom a letter or note is addressed
P5096,所在乘组,,member of the crew of,乘务员所服务的交通工具,,"person who has been a member of a crew associated with the vessel or spacecraft. For spacecraft, inverse of crew member (P1029), backup or reserve team or crew (P3015)"
P171,父级分类单元,,parent taxon,某一分类单元最低级别的上级分类单元,,closest parent taxon of the taxon in question
P21,性別,жыныс,sex or gender,应由下面择一：人：男性（Q6581097）、女性（Q6581072）、双性人（Q1097630）、跨性別女性（Q1052281）、跨性別男性（Q2449503）；动物：雄性（Q44148）、或雌性（Q43445）,"Ер жынысты (Q6581097), әйел жынысты (Q6581072) немесе интерсексуалды (Q1097630) болуы керек","sex or gender identity of human or animal. For human: male, female, non-binary, intersex, transgender female, transgender male, agender, etc. For animal: male organism, female organism. Groups of same gender use subclass of (P279)"
P725,配音演员,дауыс актері,voice actor,配音员是以配音为主要工作内容的职业。,,"performer of a spoken role in a creative work such as animation, video game, radio drama, or dubbing over [use ""character role"" (P453) as qualifier] [use ""cast member"" (P161) for live acting]"
P6569,在此特别保护的分类群,,taxon especially protected in area,在一个地区特别受保护的物种和其他分类群，无论是否仍然存在。 不要用于国家/地方实体：改用IUCN红色名录属性。,,"species and other taxa especially protected in a area, whether still actually present or not. Do not use for countries/subnational entities: use red lists properties instead."
P4794,賽季開始,,season starts,描述体育赛季开始的月份或季,,month or season when sports competition begins
P914,USK评级,,USK rating,德国电子游戏评级,,German video game content rating - see talk page for appropriate values
P10606,,,notable role,,,"role in a theatrical, motion picture, television, or other work that a performer is particularly known for"
P272,製作商,өндірістік компания,production company,製造作品的機構,,"company that produced this film, audio or performing arts work"
P2359,,,Roman nomen gentilicium,,,"standard part of the name of a Roman, link to items about the Roman gens only"
P8865,逆元,,mathematical inverse,關於某二元運算的逆元（以P2210為限定符指出該運算）,,inverse element with respect to binary operation given as a qualifier using P2210
P3373,兄弟姊妹,ағасы/інісі/апасы/қарындасы/сіңілісі,sibling,人物有他們兄弟的對象（兄弟，姐妹等）。 使用“親戚”（P1038）為兄弟姐妹（姐夫，嫂子等）和繼兄弟（繼兄弟，繼姐妹等）,"осы адамның ағасы, інісі, апасы, қарындасы немесе сіңілісі","the subject and the object have at least one common parent (brother, sister, etc. including half-siblings); use ""relative"" (P1038) for siblings-in-law (brother-in-law, sister-in-law, etc.) and step-siblings (step-brothers, step-sisters, etc.)"
P4688,,,geomorphological unit,,,topographic or bathymetric feature to which this geographical item belongs
P4878,象征,,symbolizes,,,"symbolism of an artistic element; can also be used as a qualifier for ""depicts"" (P180) statements"
P6365,成员分类,,member category,该组织成员的维基媒体分类,,category item for members of the organization
P1811,剧集列表,сериялар тізімі,list of episodes,分集列表,,link to the article with the list of episodes for this series
P8933,項目所見景觀之分類,,category for the view from the item,用於從項目（物品、場所）所見景觀的分類,,"category for the view from this item (object, place)"
P39,担任职务,мансабы,position held,主体目前或曾经担任的客体职位或公职,,subject currently or formerly holds the object position or public office
P1999,,,UNESCO language status,,,degree of endangerment of a language conferred by the UNESCO Atlas of World Languages in Danger
P501,内飞于,,enclave within,被另一个地方包围即为内飞地,,territory is entirely surrounded (enclaved) by the other territory
P823,演讲者,,speaker,在該活動、儀式、主題演講、演講或文學作品中擔任演講者的人,,"person who is speaker for this event, ceremony, keynote, presentation or in a literary work"
P1040,剪輯,фильм редакторы,film editor,,,"person who works with the raw footage, selecting shots and combining them into sequences to create a finished motion picture"
