item_qid,label_zh,label_kk,label_en,description_zh,description_kk,description_en
P8031,加害人,,perpetrator,实施违法犯罪的人,,"person or organization who carried out a harmful, illegal, or immoral act"
P2365,,,Roman cognomen,,,"standard part of the name of a Roman, link to items about specific Roman cognomen only."
P7959,历史郡,,historic county,大不列顛及愛爾蘭的傳統、地理分區,,"traditional, geographical division of Great Britain and Ireland"
P3450,体育赛季所属赛事,,sports season of league or competition,体育赛季所属的赛事（赛季所属俱乐部为P5138）,,"property that shows the competition of which the item is a season. Use P5138 for ""season of club or team""."
P397,母天体,,parent astronomical body,物质及生命所依赖主要天文物体,,major astronomical body the item belongs to
P1582,产自,,natural product of taxon,该自然产物的原料（动物、植物、真菌、藻类等）,,"links a natural product with its source (animal, plant, fungal, algal, etc.)"
P306,作業系統,операциялық жүйе,operating system,操作系统，软件运行或操作系统安装在硬件上。,,operating system (OS) on which a software works or the OS installed on hardware
P1703,,,is pollinated by,,,how pollen from the male anthers is transferred to the female stigma of a flower
P1433,刊载处,,published in,刊载该作品的期刊、书籍等,,"larger work that a given work was published in, like a book, journal or music album"
P5353,學區,,school district,定居點或其他項目所屬的學區,,school district to which a settlement or other item belongs
P375,发射载具,,space launch vehicle,,,type of rocket or other vehicle for launching subject payload into outer space
P301,该分类的主话题,,category's main topic,维基媒体分类所对应的主要话题,,primary topic of the subject Wikimedia category
P3275,分镜师,,storyboard artist,个人认为这项工作的故事板艺术家,,person credited as the storyboard artist of this work
P7719,推出,,generalization of,主體命題尤其可以推出客體命題，即客體是主體的推論或特例,,"the subject statement in particular gives this object statement, or the truth of this object statement is implied by the truth of the subject statement"
P7153,重要地点,,significant place,和主體相關的重要地點,,significant or notable places associated with the subject
P208,行政机构,,executive body,该地的行政机关,,branch of government for the daily administration of the territorial entity
P2293,遗传关联,,genetic association,,,"general link between a disease and the causal genetic entity, if the detailed mechanism is unknown/unavailable"
P8402,開放資料網站,,open data portal,能找到更多資料的開放資料入口網站,,the item for the open data portal belonging to this entity
P7888,合併至,,merged into,主題解散並合併至先前存在的物件中,,"the subject was dissolved and merged into the object, that existed previously"
P4952,,,safety classification and labelling,,,classification data for the identification and labelling of chemical risks associated with a product
P1049,受其崇拜,,worshipped by,崇拜某個神靈的宗教或團體/文明,,religion or group/civilization that worships a given deity
P1454,法律形式,,legal form,组织的法律形式,,legal form of an entity
P9901,,,issuing agent of work,,,"organization, agency, or other entity responsible for issuing a serial or other continuing resource, such as the official publication of the entity; distinct from commercial publisher of the resource"
P1620,原告人,,plaintiff,訴訟當事人,,party who initiates a lawsuit
P102,黨籍,,member of political party,某人所參加（或曾參加）/附屬（或曾附屬）的政黨,,the political party of which a person is or has been a member or otherwise affiliated
P7561,項目內部專用共享資源分類,,category for the interior of the item,用於描述項目（物品、場所）內部景觀的媒體檔案之共享資源分類,,"Commons category for media files depicting interior views of this item (object, place)"
P3764,,,pole position,,,"person, who starts race at first row (leader in the starting grid)"
P1441,登场作品,,present in work,虚构角色或事物出场的作品,,"this (fictional or fictionalized) entity, place, or person appears in that work as part of the narration (use P2860 for works citing other works, P361/P1433 for works being part of other works, P1343 for entities described in non-fictional accounts)"
P437,发行方式,тарату форматы,distribution format,作品发行的方法（或类型）,,method (or type) of distribution for the subject
P127,所有者,,owned by,主体的所有者,,owner of the subject
P3975,总书记,,general secretary,,,"leader of a political or international organization, sometimes below the chairperson (P488)"
P4510,描述一个项目使用实体,,describes a project that uses,此輸出中描述的項目中使用的基本組件或工具,,essential component or tool that was used in this project
P172,族群,этностық тобы,ethnic group,主体的种族（共识是要使用此字段，需要非常高质量的证据。这通常意味着1.主体自行主张、或2.学者对此广泛认可、或3.是如此虚构并描写的）,"субъектінің ӨЗІ мақұлдауы керек, не ғалымдардың консенсусымен расталуы керек (кейіпкер жағдайында этносы жұмыс мәтінімен расталуы керек)","subject's ethnicity (consensus is that a VERY high standard of proof is needed for this field to be used. In general this means 1) the subject claims it themselves, or 2) it is widely agreed on by scholars, or 3) is fictional and portrayed as such)"
P930,电气化方式,,type of electrification,,,electrification system scheme and/or voltage
P3156,ACB评级,,Australian Classification,,,content rating of an audiovisual work or video game in the Australian Classification system
P495,原產地,туған елі,country of origin,出产地（作品、食物、产品等）,,"country of origin of this item (creative work, food, phrase, product, etc.)"
P1434,所處虛構世界,,takes place in fictional universe,某虛構作品中一切事物所處的世界,,"the subject is a work describing a fictional universe, i.e. whose plot occurs in this universe"
P944,命名法规,,code of nomenclature,生物分類學名的命名法規,,the code that governs the scientific name of this taxon
P1891,签署方,,signatory,签署了正式文件的人、国家或组织（作者请改用P50）,,"person, country, or organization that has signed an official document (use P50 for author)"
P7137,致谢,,acknowledged,,,persons or institutions acknowledged on a creative work
P6241,建立者,,collection creator,,,"entity (person, organization, etc.) that caused a record or collection to be produced or gathered"
P7374,教育阶段,,educational stage,,,"educational stage of a specific school; qualifier of ""educated at"" (P69): the education stage of someone's attendance of school"
P2061,长宽比,,aspect ratio (W:H),电影、照片等图像的长和宽的比例,,"image width to height ratio of films, photographs, and other images"
P1657,美國電影協會電影評級,,MPA film rating,美國電影協會管理的美國電影分類,,US film classification administered by the Motion Picture Association
P463,成员属于,мүшесі,member of,主题所归属的组织、俱乐部或音乐组合。不要用于种族或社会团体的成员，也不要用于政治职务，例如某个议会的议员（请改用P39）,"көрсетілген ұйым, клуб, не топтың мүшесі; этностық/әлеуметтік, не партиялар/парламенттік топтар үшін басқаны көріңіз (P39)","organization, club or musical group to which the subject belongs. Do not use for membership in ethnic or social groups, nor for holding a political position, such as a member of parliament (use P39 for that)"
P4320,,,mountains classification,,,person ranked for this cycling stage or race
P1533,相关姓氏,,family name identical to this given name,姓氏與給定的名字相同。 用於給定名稱的項目,,last name that is the same as a given first name. Use on items for given names
P38,货币,,currency,项目使用的货币,,currency used by item
P10588,,,academic calendar type,,,academic calendar system used by an educational institution
P5460,,,grants,,,"confers degree, honor, award, prize, title, certificate or medal denoting achievement to a person or organization"
P5052,監事會成員,,supervisory board member,組織的監督委員會成員,,member(s) of the supervisory board for the organization
P927,解剖位置,,anatomical location,,,where in the body or cell does this feature lie or happen
P1420,同物異名,,taxon synonym,分類單元的其他拉丁名稱,,name listed as synonym of a taxon name
P9566,,,diel cycle,,,"pattern of diel activity in animals, such as ""nocturnal"" (Q101029366), ""diurnal"" (Q4284186)"
P2575,,,measures,,,physical quantity that this device measures
P737,受影响自,,influenced by,該人物/想法受到某人事時地物啟發,,"this person, idea, etc. is informed by that other person, idea, etc., e.g. “Heidegger was influenced by Aristotle”"
P1876,载具,,vessel,事件涉及的船只、航天器等载具,,"vessel involved in this mission, navigation or event"
P5150,IGAC等级,,IGAC rating,,,rating of a film or theatrical production in the Portuguese classification system
P157,殺害者,өлтірген адам,killed by,杀死主体的人,кім өлтіргенін белгілеуге арналған,person who killed the subject
P2210,相对于,,relative to,,,qualifier: what a statement value is relative to
P1336,领土主张,,territory claimed by,主張其對某一地區控制的行政實體,,administrative divisions that claim control of a given area
P6978,中间姓,,Scandinavian middle family name,,,"middle name of some people from Denmark or Norway where a family name, usually the mother's, is taken on as a ""middle name"". For given names based on family names, use ""given name"" (P735). For Spanish names, use P734/P1950."
P1672,产物,,this taxon is source of,该生物分类单元的自然产物。注意这里的产物可能产自一种或多种分类单元。,,"links a taxon to natural products it produces. Note that it does not say ""this taxon is the source of"" or ""this taxon is a source of"" as this may vary. Some products may be yielded by more than one taxon."
P6166,引用原文出处,,quotes work,本作品所引用原文的出处,,"other creative work which this work quotes from textually, verbally or lyrically"
P10280,该实体的荣誉公民类别,,category for honorary citizens of entity,,,"category containing the honorary citizens of a settlement (administrative unit, country). Honorary citizens may or may not be citizens of the country"
P3823,《民族語》語言狀態,,Ethnologue language status,Ethnologue.com 所使用評量語言狀態的 EGIDS 指標。,,language status identifier by Ethnologue.com using EGIDS scale
P138,名称由来,құрметіне аталған,named after,激发主体名称或同名的实体或事件（至少用一种语言）。 修饰符“适用于名称”(P5168) 可用于指示哪一个,"бұл нәрсенің осылай аталуына себепкер болған адам, оқиға немесе бір нәрсе","entity or event that inspired the subject's name, or namesake (in at least one language). Qualifier ""applies to name"" (P5168) can be used to indicate which one"
P5004,反對,,in opposition to,社會行動所反對的對象,,object of a social action
P6087,教练所属体育队,,coach of sports team,,,sports club or team for which this person is or was on-field manager or coach
P1000,纪录,,record held,某实体所取得的纪录,,"notable record achieved by a person or entity, include qualifiers for dates held"
P360,列表所属项目,бұл тізімде келесі нәрселер тізілген,is a list of,列表所描述的主題,,common element between all listed items
P504,母港,,shipping port,船只作为基地的港口,,"shipping port of the vessel (if different from ""ship registry""): For civilian ships, the primary port from which the ship operates. Port of registry →P532 should be listed in ""Ship registry"". For warships, this will be the ship's assigned naval base"
P275,许可协议,,copyright license,这个版权作品释出时使用的协议,,license under which this copyrighted work is released
P9235,,,seismic classification,,,seismic risk zone which the administrative entity that receives the seismic classification is in
P1654,,,wing configuration,,,configuration of wing(s) used by an aircraft
P5607,,,located in the religious territorial entity,,,the item is located on the territory of the following religious entity. Use P708 (diocese) for dioceses
P1990,饲养品种,,species kept,分类群，最好是物种，存在于动物园、植物园、收藏馆或其他机构。不是特定的动物，不是任何地理位置的动物。,,"taxa, preferably species, present at a zoo, botanical garden, collection, or other institution. NOT specific animals, not for any geographic location"
P3602,競選,,candidacy in election,参与的选举,,election where the subject is a candidate
P4552,所属山脉,,mountain range,,,range or subrange to which the geographical item belongs
P5278,,,surname for other gender,,,"gender inflection of surname, patronymic or matronymic"
P2318,,,debut participant,,,participant for whom this is their debut appearance in a series of events
P3815,,,volcano observatory,,,institution that monitors this volcanic landform or phenomenon
P5805,OSI模型层位置,,OSI Model layer location,網路協定在OSI模型層中的位置,,location of a network protocol in one of the OSI Model layers
P31,隶属于,бірі болып табылады,instance of,此主体是其中特定示例及成员的类别；与上级分类（P279）不同；例如：富士山隶属于山，火山上级分类是山（且隶属于火山地貌）,"бұл нысан қандай да бір санаттың, класстың немесе нысандар тобының бөлігі болып табылады",that class of which this subject is a particular example and member; different from P279 (subclass of); for example: K2 is an instance of mountain; volcano is a subclass of mountain (and an instance of volcanic landform)
P2633,主题地理,,geography of topic,牽涉到該主題之地理的項目。例如：「里約熱內盧」採用的屬性「里約熱內盧地理（Q10288853）」。對於某主題的所在地，請用「位置」 (P276),,"item that deals with the geography of the subject. Sample: ""Rio de Janeiro"" uses this property with value ""geography of Rio de Janeiro"" (Q10288853). For the location of a subject, use ""location"" (P276)."
P2564,柯本气候分类,,Köppen climate classification,地区气候特性,,indicates the characteristic climate of a place
P1347,軍事傷員分類,,military casualty classification,,,"allowed values:  killed in action (Q210392), missing in action (Q2344557), died of wounds (Q16861372), prisoner of war (Q179637), killed in flight accident (Q16861407), others used in military casualty classification"
P2737,并集属于,,union of,本类的元素是至少一个所列类的元素,,"every instance of this class is an instance of at least one class in that list of classes. Use ""list item"" P11260 as qualifiers to specify the list of classes"
P2286,动脉供应,,arterial supply,,,arterial supply of an anatomical structure
P427,模式分类群,,taxonomic type,科（或亚科等）的模式属；属（或亚属等）的模式种,,name-bearing genus or species of this nominal family or genus (or subfamily or subgenus)
P8371,参考作品、传统或理论,,"references work, tradition or theory",本作品参考的其他作品、传统或理论,,"creative work, tradition or theory this creative work references by allusion, quote or similar means (for citations in scholarly and legal works use P2860, for other more specific properties have a look at ""see also"" on the property page)"
P543,宣誓者,,oath made by,在奧運會等活動中宣誓的人,,"person(s) that made the oath at an event, like the Olympic Games"
P7167,不導致,,does not have effect,此处不存在此类成员的预期效果或通常效果,,expected effect or usual effect of members of this class absent here
P20,死亡地,,place of death,人、动物或虚构人物最具体的已知（例如城市而不是国家，或医院而不是城市）死亡地点,,"most specific known (e.g. city instead of country, or hospital instead of city) death location of a person, animal or fictional character"
P9215,,,set during recurring event,,,"recurring event (e.g. season, month, holiday) during which this fictional work is set"
P423,,,shooting handedness,,,whether the hockey player passes or shoots left- or right-handed
P2505,承载,,carries,某座桥或某条隧道承载的项（道路、铁路等）,,"item (e.g. road, railway, canal) carried by a bridge, a tunnel or a mountain pass"
P831,附属俱乐部,,parent club,,,parent club of this team
P2975,宿主,,host,,,an organism harboring another organism or organisms on or in itself
P2512,有衍生作品,спин-офф,has spin-off,該項目的衍生作品,,works that are spin-offs of this item
P2033,依相机拍摄的照片分类,,category for pictures taken with equipment,使用該相機型號或型號系列拍攝的照片的共享資源分類,,Commons category for photos taken with that camera model or model line
P403,河流出口,,mouth of the watercourse,河流注入何处,,the body of water to which the watercourse drains
P279,上级分类,сынып тармағы,subclass of,比当前项目更高一级的类或类型； 这些项目的所有实例都是这些项目的实例； 该项目是该项目的一个类（子集）。 不要与 P31 (隶属于/instance of) 混淆,ос сыныптың (класс) әрбір данасы келесі сыныптардың данасы болып табылады. P31 («бірі болып табылады») шатыстыруға болмайды,"this item is a subclass (subset) of that item; all instances of this item are instances of that item; different from P31 (instance of), e.g.: K2 is an instance of mountain; volcano is a subclass of mountain (and an instance of volcanic landform)"
P190,友好城市,,twinned administrative body,孪生城镇、姊妹城市、孪生直辖市和其他有伙伴关系或合作协议的地方，无论是法律上还是非正式上都得到政府承认,,"twin towns, sister cities, twinned municipalities and other localities that have a partnership or cooperative agreement, either legally or informally acknowledged by their governments"
P136,類型,жанр,genre,作品的類型或藝術家的創作風格，作品的主題見P921,,creative work's genre or an artist's field of work (P101). Use main subject (P921) to relate creative works to their topic
P6153,研究地點,,research site,展開研究和實驗的地方,,place where this item was researched
P3096,KML檔案,,KML file,项目链接到维基页面包含一个相关的锁眼标记语言文件的文本,,item with sitelinks to wikimedia page containing text of a relevant KML file
P7779,軍事單位,,military unit,该人所属的的最小军事单位,,smallest military unit that a person is/was in
P4043,模拟,,emulates,模拟识别的平台，中央處理器或系统,,"emulates the identified platform, CPU, or system"
P1343,记载处,,described by source,有记载并描述此项的文献等出处,,work where this item is described
P910,话题主分类,негізгі тақырып санаты,topic's main category,主要的维基媒体分类,,main Wikimedia category
P35,国家元首,,head of state,在一个国家拥有最高官方权力的官员,,official with the highest formal authority in a country/state
P16,交通網路,,transport network,交通线路所屬的系統（或特定國家特定的道路類型）,,network the infrastructure is a part of
P11799,,,alternate universe counterpart,,,this fictional character/entity is an alternate universe counterpart of the subject
P4614,所属流域,,drainage basin,降水彙集並排入共同出口，如河流、海灣或其他水體的區域,,"area where precipitation collects and drains off into a common outlet, such as into a river, bay, or other body of water"
P5475,中日韓越異體字,,CJKV variant character,,,equivalent form of this CJKV character used in different regions or writing systems over time
P6477,不具备的特性,,does not have characteristic,该项目不具备的预期特性,,expected quality that the item does not possess
P6275,版權代表人,,copyright representative,有權代行該人或組織著作權之人或組織,,person or organisation who represents the copyright for this person or work of art
P113,航空枢纽,,airline hub,被航空公司視為樞紐的機場,,airport that serves as a hub for an airline
P50,作者,автор,author,书面作品的主要创作者（用于作品项目，而不是人类项目）；当维基数据项目未知或不存在时使用P2093（作者名字符串）,,"main creator(s) of a written work (use on works, not humans); use P2093 (author name string) when Wikidata item is unknown or does not exist"
P27,國籍,азаматтығы,country of citizenship,承認主體是其公民的客體國家,осы адамды өзінің азаматы ретінде танитын мемлекет,the object is a country that recognizes the subject as its citizen
P9072,从这个物种的组织内分离,,derived from organism type,不同于P703，该属性表示这个细胞株从某个物种的组织内分离而来，而细胞株只能从一个物种内分离,,the taxon that the organism from which the subject cell line was derived belonged to (different from found in taxon (P703) because cell lines are derived only once from a single individual)
P8453,車站,,public transport stop,邻近车站,,"general (e.g. nearest) public transport stop (bus, tram, train, subway)"
P3781,,,has active ingredient,,,"has part biologically active component; inverse of ""active ingredient in"" (P3780)"
P1366,後繼者,,replaced by,接替某人、某職稱或某事物的項目。如果此項目不是替代者，僅為接續者（例如：系列書籍），請使用P156。,,"other person or item which continues the item by replacing it in its role. Use P156 (""followed by"") if the item is not replaced nor identical, but adds to the series (e.g. books in a series)."
P1740,取景地分類,,category for films shot at this location,該對像是在主題處或主體中拍攝的電影的類別,,the object is a category for films shot at or in the subject
P5816,保存狀態,,state of conservation,,,"to indicate state of conservation of a building, monument, artifact, etc. It is not related with its heritage protection (P1435), but to its present state of conservation. Ex.: ruinous, demolished, correct, etc."
P1027,颁发者,,conferred by,頒發獎品或授予榮譽的人或組織,,"person or organization who grants an award, certification, grant, or role"
P612,母屋,,mother house,宗教學院的主要住所或社區,,principal house or community for a religious institute
P1056,产品,,product or material produced or service provided,一个地矿、工业设施或工业程序所生产的物质,,"material or product produced by an organization, industry, facility, or process"
P2679,序言作者,,author of foreword,撰寫該書序言，前言或介紹但不是本書其餘部分作者的人,,"person who wrote the preface, foreword, or introduction of the book but who isn't an author of the rest of the book"
P25,母亲,,mother,女性家长。继母使用P3448。,,"female parent of the subject. For stepmother, use ""stepparent"" (P3448)"
P9241,该主题人口统计,,demographics of topic,,,item that deals with demographics of the subject
P769,,,significant drug interaction,,,"clinically significant interaction between two pharmacologically active substances (i.e., drugs and/or active metabolites) where concomitant intake can lead to altered effectiveness or adverse drug events."
P5025,,,gens,,,a clan or group of families from Ancient Rome who shared the same nomen
P3858,路線圖,,route diagram template,,,Wikimedia template with route diagram
P485,存檔于,,archives at,持有該主題檔案的機構,,the institution holding the subject's archives
P6819,書法家,,calligrapher,,,calligrapher of a work
P1536,直接结果,,immediate cause of,,,immediate effect of this cause
P1192,所屬路線,,connecting service,停靠某車站的路線服务,,service stopping at a station
P1840,,,investigated by,,,person or organization involved in investigation of the item
P6291,,,advertises,,,"cause, organization or product targeted by the advertising campaign, character, jingle or slogan"
P1046,发现方法,,discovery method,發現一顆系外行星的方式,,way an exoplanet was discovered
P59,星座,,constellation,主体所属的天球区域（从科学的角度，而不是占星学的角度）,,"the area of the celestial sphere of which the subject is a part (from a scientific standpoint, not an astrological one)"
P8026,,,LiverTox likelihood score,,,categorization of the likelihood that a medication is associated with drug induced liver injury that was developed by the Drug-Induced Liver Injury Network (DILIN) Network and published in NCBI's LiverTox
