item_qid,label_zh,label_kk,label_en,description_zh,description_kk,description_en
P522,轨道类型,,type of orbit,,,orbit a satellite has around its central body
P2321,總積分排名,,general classification of race participants,,,classification of race participants
P400,平台,платформа,platform,開發和運行作品的平台，作品可能不同版本運行在不同平台,,"platform for which a work was developed or released, or the specific platform version of a software product"
P822,吉祥物,,mascot,组织的吉祥物，例如 运动队或大学,,"mascot of an organization, e.g. a sports team or university"
P12687,,,category for deaths in this time period,,,category item for people who died in this time period
P10602,,,applicant,,,"applicant to a grant, program, or other funding agency or rating organization"
P880,中央处理器,,CPU,在主题项目中找到中央处理单元,,central processing unit found within the subject item
P8307,排序,,has sorting,,,"entries are sorted by this in the appendix, list or table"
P1346,獲勝者,жеңімпаз,winner,在某項活動中取得勝利的一方,,"winner of a competition or similar event, not to be used for awards (instead use ""award received"" (P166) on awardee's item, possibly qualified with ""for work"" (P1686)) or for wars or battles"
P749,母組織,,parent organization,一個組織的母方組織，是子組織（P355）的逆屬性,,"parent organization of an organization, opposite of subsidiaries (P355)"
P1640,館長,,curator,負責此收藏的內容專家,,content specialist responsible for this collection or exhibition
P58,編劇,сценарист,screenwriter,为主体项目编写剧本的人,,person(s) who wrote the script for subject item
P1079,,,launch contractor,,,organization contracted to launch the rocket
P5995,体育用品供应商,,kit supplier,,,"official supplier of sports goods to a given sports club, sportsperson or a national sports team"
P1290,,,godparent,,,person who is the godparent of a given person
P3448,繼父母,,stepparent,主體具有的作為其繼父母的對象,,subject has the object as their stepparent
P8646,资料片原作,,expansion of,本项目作为资料片对应的原作游戏（电子游戏、桌上游戏或棋盘游戏）,,"expansion pack of a game (video game, tabletop or board game)"
P7936,商业模式,,business model,,,business model a business enterprise or creative work operates under
P3095,从业者,,practiced by,研究該主題或從事該專業的代理人類型,,type of agents that study this subject or work in this field
P4006,,,overrules,,,case that supersedes another case
P2354,相关列表,сәйкес тізім,has list,该主题相关的维基媒体列表条目,,Wikimedia list related to this subject
P2922,月份,,month of the year,,,"month of the year during which this item occurs, applies to or is valid in"
P287,设计者,,designed by,負責設計這個項目的人,,person(s) or organization which designed the object
P291,出版地,жарияланған жері,place of publication,項目第一版的出版地,,geographical place of publication of the edition (use 1st edition when referring to works)
P1304,中央銀行,,central bank,此地區的中央銀行,,country's central bank
P159,总部位置,,headquarters location,组织机构总部所在或曾经所在的城市。 对特定建筑物使用 P276 修饰符,,"city or town, where an organization's headquarters is or has been situated. Use P276 qualifier for specific building"
P2634,模特,,model,在作品创作期间摆姿势的人，无论该人最终是否被描绘成当事人,,"person who appears in an artwork or photograph, in the role of an artist's model, rather than subject"
P66,籍貫,,ancestral home,主体祖先的起源地,,place of origin for ancestors of subject
P5056,此人名字中的父名或母名,,patronym or matronym for this person,採用父母子女連名傳統的人名中，包含父親個人名或母親個人名的部份，一般上和姓氏不同，或者沒有姓氏,,"part of a person's name that comes from the given name of a parent, in naming traditions that require it"
P1318,证明者,,proved by,,,person who proved something
P1557,表现概念,,manifestation of,给定概念的物理体现,,inherent and characteristic embodiment of a given concept
P408,软件引擎,,software engine,开发此项目时使用的软件引擎,,software engine employed by the subject item
P840,敘事發生地,баяндау орны,narrative location,此作品所述内容发生的地方,,the narrative of the work is set in this location
P3279,,,statistical leader,,,"leader of a sports tournament in one of statistical qualities (points, assists, rebounds etc.). Don't use for overall winner. Use a qualifier to link to the item about the quality."
P5304,模式产地（生物）,,type locality (biology),,,"geographical place of capture, collection or observation of the name-bearing type"
P3716,社會階層,,social classification,傳統或國家法律認可的社會分組,,social class as recognized in traditional or state law
P2360,受眾,,intended public,這項作品，產品，對象或事件是為那個人或一群人，動物，植物等設計的，或者是為這個人或一組人設計的,,"this work, product, object or event is intended for, or has been designed to that person or group of people, animals, plants, etc"
P1199,遺傳模式,,mode of inheritance,特定遺傳特徵或疾病代間遺傳的方式,,manner in which a particular genetic trait or disorder is passed from one generation to the next
P5059,版本修改自,,modified version of,作品或其版本，作為改編的基礎，從而衍生出作品的特定版本,,indicates the work or one of its versions which served as a basis for the adaptation or arrangement resulting in the given version of the work
P1909,副作用,,side effect,,,"effect of a medication or procedure, that occurs next to the desired effect"
P12686,,,category for births in this time period,,,category item for people who born in this time period
P3022,持旗手,,flag bearer,,,person who carries the national flag of their country at an opening or closing ceremony
P3501,,,Christian liturgical rite,,,Christian liturgical rite associated with this item
P206,相接水体,,located in or next to body of water,主体相邻或所处的湖泊、河流或海域,,body of water on or next to which a place is located
P744,,,asteroid family,,,population of asteroids that share similar proper orbital elements
P241,军事部门,,military branch,军事单位、奖项、职位、个人等所属的军种或部队，例如英国皇家海军,,"branch to which this military unit, award, office, or person belongs, e.g. Royal Navy"
P9883,创办目的,,created for,,,"a work, event, etc. for which the subject work was created (e.g., a presidential inauguration that a poem was written for; a competition that a play was created for; a film that a screenplay was written for)"
P199,业务部门,,business division,本组织的组织部门（不是独立的法人实体）,,organizational divisions of this organization (which are not independent legal entities)
P7084,相关分类,,related category,,,Wikimedia category is related to this item
P108,雇主,,employer,主体（或曾）为其工作的个人或组织,,person or organization for which the subject works or worked
P98,編輯者,,editor,编辑工作的编辑，如书或定期刊物 (報紙或學術期刊),,"person who checks and corrects a work (such as a book, newspaper, academic journal, etc.) to comply with a rules of certain genre. Also applies to person who establishes the text of an ancient written work or manuscript."
P3730,上一級,,next higher rank,排名較高的等級或級別，如體育聯盟，軍銜。 如果有多種可能，列出每一個並符合“使用的標準”（P1013），請避免使用排名和日期限定符。 對於體育聯盟/分類群，請使用特定屬性。,,"higher rank or level in a ranked hierarchy like sport league, military ranks. If there are several possible, list each one and qualify with ""criterion used"" (P1013), avoid using ranks and date qualifiers. For sports leagues/taxa, use specific properties instead."
P126,维护者,,maintained by,负责维护的人或组织,,person or organization in charge of keeping the subject (for instance an infrastructure) in functioning order
P828,起因,,has cause,根本原因，导致某种结果的因素,,"underlying cause, thing that ultimately resulted in this effect"
P2974,栖息地,,habitat,,,"the natural environment in which an organism lives, or the physical environment that surrounds a species population"
P3610,收费区,,fare zone,,,fare zone that the station is in
P8989,項目景觀的分類,,category for the view of the item,用於項目（物品、場所）景觀的分類,,"category for the view of this item (object, place)"
P1445,處於該虛構世界之作品,,fictional universe described in,连结虚构世界至使用该世界观的作品：<世界>P1445<作品>,,"to link a fictional universe with a work that describes it: <universe> ""described in the work:"" <work>"
P2851,接受的付款方式,,payment types accepted,,,types of payment accepted by a venue
P137,運營者,,operator,負責運營的個人、機構或組織等,,"person, profession, or organization that operates the equipment, facility, or service"
P3025,開放日,,open days,,,days in the week subject item is open within the opening season
P736,封面艺术家,,cover art by,为书籍、唱片集、单曲等创作封面艺术作品的个人或团队的姓名,,"name of person or team creating cover artwork for book, record album, single record etc."
P17,国家,мемлекет,country,此项目位于的主权国家（不可用于人类）,осы нәрсе (элемент) тиесілі мемлекет,sovereign state that this item is in (not to be used for human beings)
P3174,艺术总监,,art director,,,"person credited as the art director/artistic director of this work; manages the process of making the visuals, which is done by concept artists, graphic designers, set designers, costume designers, lighting designers; See also P8938 for organizations"
P1594,法官,,judge,主审该案的法官、地方法官或同等人士,,"judge, magistrate or equivalent, presiding at a trial"
P2358,,,Roman praenomen,,,"standard part of the name of a Roman, link to items for specific Roman praenomen only"
P1427,行程起点,,start point,旅程、航班等的起始地点,,"starting place of this journey, flight, voyage, trek, migration etc."
P2389,主管機構,,organization directed by the office or position,該職位或人物所管之機構組織,,organization which is directed by this office
P2579,研究学科,,studied in,研究该主题的学科或领域,,subject is studied by this science or domain
P5444,,,model year,,,"year a specific model of a product (such as a car) was released, likely different from the actual year of production"
P9969,,,critical catalogue,,,"a comprehensive, annotated listing of all the known artworks by an artist either in a particular medium or all media."
P110,插画家,,illustrator,给书做插图的人,,person drawing the pictures or taking the photographs in a book
P2408,時代背景,,set in period,历史或未来时期的作品的設定,,"historical, contemporary, or future period, year, century or day the work or genre is set in or event featured in the story of the work"
P193,主要承建商,,main building contractor,負責建造這種結構或建築物的主要組織,,the main organization (or person) responsible for construction of this structure or building
P6440,维护方法,,maintenance method,,,"method or steps that maintain, clean up, or repair this item and lengthens its lifespan"
P2438,敘事者,,narrator,解说员、画外音旁白,,"narrator, character or person that tells the story"
P1034,主要食物來源,,main food source,,,"species, genus or family that an organism depends on for nutrition"
P7479,,,key col,,,highest col connecting to an even higher point
P7763,創作者著作權狀態,,copyright status as a creator,創作者全部作品版權保護期是否届滿，或者處於公有領域,,states if the body of work published during the lifetime of this creator is still copyrighted or in the public domain
P7376,被穿著,,worn by,,,person who wears or wore a garment or object
P1151,话题主要维基媒体主题,,topic's main Wikimedia portal,關於此主題的維基媒體入口導覽頁,,Wikimedia portal associated with this topic
P2541,業務區,,operating area,組織或行業在其中運營，服務或負責的地理區域或管轄範圍,,"geographic area or jurisdiction an organisation or industry operates in, serves, or has responsibility for"
P1080,所属虚构世界,,from narrative universe,主体所属的虚构世界,,subject's fictional entity is in the object narrative. See also P1441 (present in work) and P1445 (fictional universe described in)
P853,CERO評級,,CERO rating,日本的電玩評級系統，可用值請見討論頁。,,Japanese video game rating system
P741,,,playing hand,,,"hand used to play a racket sport, cricket, fencing, or curling"
P1465,死亡地分类,,category for people who died here,在此地死亡者的页面分类,,category item for people who died in this location
P4770,水合物,,hydrated form of,,,given compound is an anhydrous form of this compound
P1753,分类相关列表,,list related to category,与某个维基媒体分类相关的维基媒体列表项,,Wikimedia list equivalent to a Wikimedia category
P2852,緊急救助電話,,emergency phone number,聯絡緊急服務的電話號碼,,telephone number to contact emergency services
P466,占用者,,occupant,占用某物产（建筑物或用地）的人或组织,,person or organization occupying property
P6872,投稿于,,has written for,,,publication an author has contributed to
P97,贵族头衔,,noble title,人物所拥有的头衔,,titles held by the person
P765,,,surface played on,,,the surface on which a sporting event is played
P131,所在行政领土实体,,located in the administrative territorial entity,此项所地处的，代表领土一部分的上级行政实体。指定所处非行政性地点，或有关活动的项时，请使用P276（位置）,,the item is located on the territory of the following administrative entity. Use P276 for specifying locations that are non-administrative places and for items about events. Use P1382 if the item falls only partially into the administrative entity.
P511,勋衔前缀,,honorific prefix,,,"word or expression used before a name, in addressing or referring to a person"
P767,创作作品或主题贡献者,,contributor to the creative work or subject,对作品创作有贡献的人或组织,,person or organization that contributed to a subject: co-creator of a creative work or subject
P5537,韓語漢字音,,Hangul pronunciation,某漢字在韓語諺文中的讀音表記方式,,modern Korean pronunciation(s) in Hangul for this Hanja character
P1589,最低点,,lowest point,,,"point with lowest elevation in the country, region, city or area"
P720,,,asteroid spectral type,,,"spectral classifications of asteroids based on  spectral shape, color, and albedo"
P1546,座右铭,,motto,,,description of the motto of the subject
P945,效忠对象,,allegiance,一个人或群体所效忠的国家或权力,,country (or other power) that the person or group serves
P3876,教育機構校友專用分類,,category for alumni of educational institution,包含该机构校友的分类,,category containing people who studied at this institution
P881,,,type of variable star,,,type of star
P1830,擁有,,owner of,該主体擁有的實體,,entities owned by the subject
P924,疗法,,possible treatment,,,health treatment used to resolve or ameliorate a medical condition
P2546,,,sidekick of,,,close companion of a fictional character
P4661,所建水庫,,reservoir created,一水壩上游所建之水庫,,reservoir created upstream of a dam by this dam
P122,政体,,basic form of government,主体的统治形式,,subject's government
P1956,,,takeoff and landing capability,,,type of takeoff and landing the aircraft is designed to operate
P81,线路,,connecting line,铁路线主体直接连接到,,railway line(s) subject is directly connected to
P523,初现地质年代,,temporal range start,,,the start of a process or appearance of a life form or geological unit relative to the geologic time scale
P841,圣人纪念日,,feast day,,,saint's principal feast day
P641,体育运动,,sport,人物所参与的体育运动,,sport that the subject participates or participated in or is associated with
P4195,组织员工专用分类,,category for employees of the organization,,,Wikimedia category for people who work or worked at this organization
P805,陈述主体项目,,statement is subject of,（修饰）项目，描述在此陈述中确定的关系,,(qualifying) item that describes the relation identified in this statement
P184,博士生导师,,doctoral advisor,指导该主体博士论文的人,,person who supervised the doctorate or PhD thesis of the subject
P3306,電影和音像藝術學會分級,,ICAA rating,西班牙電影內容分級系統中的分級,,rating in the Spanish motion picture content rating system
P2848,Wi-Fi访问,,Wi-Fi access,通過Wifi訪問互聯網狀況,,internet access availability through Wi-Fi
P2012,菜系,,cuisine,食物所属的菜系,,type of food served by a restaurant or restaurant chain or national food culture
P610,最高点,,highest point,区域内海拔的最高点,,"point with highest elevation in a region, or on the path of a race or route"
P825,致獻對象,,dedicated to,被獻予該項目的個人或組織,,person or organization to whom the subject was dedicated
P2978,,,wheel arrangement,,,"wheel/axle arrangement for locomotives, railcars and other rolling stock"
P814,IUCN保护区分类,,IUCN protected areas category,世界保护区委员会划分的保护区分类。,,protected areas category by the World Commission on Protected Areas. Used with dedicated items for each category.
P1408,廣播地區,,licensed to broadcast to,廣播電台或電視台獲得許可發送訊號的地區,,place that a radio/TV station is licensed/required to broadcast to
P5386,日本气象厅烈度等级,,JMA Seismic Intensity Scale,,,maximum intensity scale of this earthquake given by JMA Seismic Intensity Scale
P4934,计算方法,,calculated from,,,value of the subject item cannot be measured directly or can be calculated from the following measurands or attributes
P3075,國教,,official religion,,,official religion in this administrative entity
P6758,支持的运动队,,supported sports team,,,sports team for which a person or a group is a supporter
P1789,首席运营官,,chief operating officer,,,the chief operating officer of an organization
P7643,涵蓋時期,,covered period,,,"historical period covered, for instance by a source"
P2098,副職,,substitute/deputy/replacement of office/officeholder,某职位的副职,,function that serves as deputy/replacement of this function/office (scope/conditions vary depending on office)
P3780,為其中之有效成份,,active ingredient in,是生物活性成分的一部分並形成生物活性成分。,,"is part of and forms biologically active component. Inverse of ""has active ingredient"""
P750,經銷商,дистрибьютор,distributed by,負責作品經銷一方,,distributor of a creative work; distributor for a record label; news agency; film distributor
P3335,相关风险因子,,associated hazard,,,"hazards implicit in the subject item: that a sign warns of; that one may encounter in this place, on this thoroughfare; that are inherent properties of (or threats to) the subject; etc."
P1158,降落地點,,location of landing,飛行物降落處,,location where the craft landed
P1376,是何者的首府,,capital of,此項作為（按目標項來說）國家、省、州、部門、縣、郡或其他行政區劃政府所在地的實體,,"country, state, department, canton or other administrative division of which the municipality is the governmental seat"
P6,政府首脑,,head of government,村镇、城市、直辖区、国家或其他政府机构的行政首脑,,"head of the executive power of this town, city, municipality, state, country, or other governmental body"
P708,教區,,diocese,,,administrative division of the church to which the element belongs; use P5607 for other types of ecclesiastical territorial entities
P5023,此地點的活動方針,,activity policy in this place,,,"policy for activities in this place, for example no photos, photos allowed, no flash, lighting fires, flying drones, etc."
P3148,廢除,,repeals,本文件或法案廢除了其他文件或法案,,this document or act repeals that other document or act
P364,影視作品原始語言,фильмнің немесе телешоудың түпнұсқа тілі,original language of film or TV show,電影或表演作品最初創作時的語言。對於書面作品則已棄用；請改用P407（作品或名稱語言）,,"language in which a film or a performance work was originally created. Deprecated for written works and songs; use P407 (""language of work or name"") instead."
P826,音調,,tonality,,,key of a musical composition
P2238,官方標記,,official symbol,行政實體的官方象徵,,official symbol of an organisation
P459,确定方法,,determination method,如何确定一个值，或声明它的标准,,"how a value is determined, or the standard by which it is declared"
P12363,,,clerked for,,,this person has held a clerkship with the judge
P5196,输出方法,,output device,,,output device used to interact with a software or video game console
P780,症状,,symptoms and signs,醫學情形下的可能症狀,,possible symptoms or signs of a medical condition
P3490,,,muscle origin,,,the anatomic entity to which the beginning of a muscle is anchored
P101,工作领域,жұмыс саласы,field of work,某个人或组织的专业；职业请见P106,"ұйым, не адам үшін: элементпен байланысты қызметтің негізгі саласы (мысалы, физикалық құбылыс үшін физика, адам үшін астрономия); кәсіппен (физик) шатастыруға болмайды (P106)",specialization of a person or organization; see P106 for the occupation
P1340,瞳色,,eye color,对一个人的眼睛虹膜的颜色,,color of the irises of a person's eyes
P277,编程语言,,programmed in,開發軟件的編程語言,,the programming language(s) in which the software is developed
P3137,母峰,,parent peak,自本山峰下降至主鞍部（key col）但不降至更低處，可爬升到的最高峰,,"parent is the peak whose territory this peak resides in, based on the contour of the lowest col"
P1403,原始組合,,original combination,用於動物：在這組物種的分類上學名首次發表時所使用（雙名法或三名法）的組合,,for animals: the combination (binomen or trinomen) where the species-group name used in this taxon name was first published
P770,遭毀壞原因,,cause of destruction,,,item which caused the destruction of the subject item
P6439,,,has lyrics,,,work whose text is used as the lyrics of this work
P4132,语言类型学,,linguistic typology,,,classification of languages according to their linguistic trait (as opposed to historical families like romance languages)
P7782,,,category for ship name,,,Commons category for a name of a ship
P19,出生地,туған жері,place of birth,人、動物或虛擬角色的已知最詳細誕生地點（例如城市而不是国家，或医院而不是城市）,"нысанның нақты туған ауруханасы, қаласы, мемлекеті","most specific known birth location of a person, animal or fictional character"
P3033,软件包管理系统,,package management system,包管理系统用于发布软件,,package management system used to publish the software
P410,军衔,,military rank,一個人取得的軍銜（通常應該有一個“開始日期”限定符），或者與一個職位相關的軍銜,,"military rank achieved by a person (should usually have a ""start time"" qualifier), or military rank associated with a position"
P1951,投資者,,investor,為了獲得投資回報而對該項目進行投資的個人或組織,,individual or organization which invests money in the item for the purpose of obtaining financial return on their investment
P6875,,,motif represents,,,"object or concept from which this motif is derived, or which it represents"
P4599,,,monomer of,,,polymer composed of this monomer subunits
P3919,,,contributed to creative work,,,"person is cited as contributing to some creative or published work or series (qualify with ""subject has role"", P2868)"
P6112,,,category for members of a team,,,Wikimedia category for players playing for a sports team
P85,颂歌,,anthem,主体的官方象征性歌曲,,subject's official anthem
P2388,機構主管職位,,office held by head of the organization,該機構項目的首長、負責人職位,,position of the head of this item
P541,競逐之職位,,office contested,该次选举中候选人所竞争的职位,,title of office which election will determine the next holder of
P4100,黨團,,parliamentary group,由議員在議會內組成的黨組織,,parliamentary group to which a member of a parliament belongs
P9086,文化部影視及流行音樂產業局電影分級,,BAMID film rating,臺灣電影內容分級制度,,rating in the Taiwanese movie content rating system
P411,冊封狀態,,canonization status,每個受試者宗教組織獲得聖徒的過程中的階段,,Formal stage in the process of attaining sainthood per the subject's religious organization
